{
  "schema_version": 2,
  "service_id": "workflow-usage",
  "display_name": "Pipeline usage, outcomes and user satisfaction",
  "governed_paths": [
    "scripts/workflow_usage.py",
    "scripts/operational_incidents.py",
    "scripts/model_data_report.py",
    "scripts/notarized_run_receipt.py",
    "skills/vera/references/workflow-usage.md",
    "usage/pipelines.json",
    "scripts/reporting_product.py",
    "scripts/incident_host_mcp.cjs",
    "scripts/technical_runner.py"
  ],
  "governed_repository_paths": [
    "modules/workflow_usage",
    "modules/operational_incidents/api.py",
    "modules/operational_incidents/store.py",
    "scripts/manage_workflow_usage.py",
    "templates/vera_workflow_feedback.html",
    "static/shared/vera/workflow-feedback.js",
    "static/shared/vera/workflow-feedback.css",
    "static/shared/vera-testing-status.js",
    "static/shared/vera/index.html",
    "plugins/_shared/reporting-runtime",
    "scripts/sync_reporting_runtime.py"
  ],
  "runtime_profiles": [
    "openai-codex",
    "anthropic-cowork"
  ],
  "external_boundaries": [
    {
      "controls": [
        "Events are durably queued before transport and acknowledged by exact UUID, owner, sequence and hash. Interruptions stay outcome unknown; repeated submissions are idempotent.",
        "Synthetic and agent-test runs are excluded from user metrics. Studio Archive is infrastructure and cannot be selected as a rated process.",
        "The host AI selects the primary process and observes actual task completion. Counters and hashes do not assert professional correctness or independent model delivery.",
        "The operational client honors an explicitly selected local-only HTTP delivery setting for this execution; this does not change synthetic-run exclusion, rating authorization or model-provider processing.",
        "The shared implementation binds registrations, OAuth resources, task events, report signatures, feedback and update downloads to one product. Existing unmapped installations and receipt schema 1 remain Vera. Physical-computer identity is shared, while usage catalogues and testing epochs are separated by product.",
        "Authenticated event acknowledgements and run status expose the original owner's proven Computer ID and retain any historical usage-task receipt link. Selected Vera pipelines report Archive-run ownership, not a missing usage-task receipt. This projection does not establish whether an Archive report or receipt exists; verification uses that Archive run's saved report and proof. No separate task receipt link is required. Neither reporting gap changes the professional outcome or authorizes broader host access.",
        "When local HTTPS is unavailable, the authenticated connector can stamp the exact retained receipt request for an owned run. The allow-list admits only receipt UUID, product/version, schema and report digest. It returns the same signed proof; a separate verified receipt event links it to the original run. No report or source contents are transmitted.",
        "Connector-owned workflow acknowledgements return a random 15-minute proof scoped only to binding that original run to a native computer. The existing native helper adds its private computer capability and observed app. The server stores only the ticket hash, checks product, expiry and app, rejects re-binding, and never replaces the original owner or associates all runs from one saved connection with one computer. The proof cannot authorize other reporting operations. Exact event replay obtains a fresh proof without another event.",
        "Ordinary startup and outcome delivery select only the retained task UUID. Scoped flush and connector inspection return only that task's pending events/count; unrelated retained events cannot make its delivery pending. Startup context exposes only a diagnostic backlog count, without unrelated task IDs. Whole-outbox maintenance is separate; historical event bytes and owner/hash acknowledgement checks are preserved.",
        "The native plugin service exposes fixed task start, observed event, status and task-scoped retry operations using the existing local reporter and computer identity. It persists events in the existing user-scoped database without requiring the chat shell to write outside its project. It accepts no client file paths, shell commands, replacement credentials or global queue flush. Storage failures retain structured operation/error evidence and cannot certify delivery or invalidate professional output."
      ],
      "id": "automatic-task-lifecycle",
      "purpose": "Measure which user processes run and their observed outcome; link existing signed model-data receipts and technical reports without copying their professional content",
      "runtime_profiles": [
        "openai-codex",
        "anthropic-cowork"
      ],
      "requires_confirmation": false,
      "kind": "hosted_service",
      "retention": "Task events, optional feedback and receipt links remain in the service until administrative deletion; no automatic expiry is implemented. Local queued events and acknowledgements remain in the existing private per-installation state directory. Lifecycle events exclude client documents and professional output. Optional feedback stores only the comment deliberately supplied by the user; its contents are not automatically anonymized. Host-link tickets expire after 15 minutes; their hashes and established run-to-computer bindings remain until administrative deletion. The raw short-lived proof is returned only in an authenticated acknowledgement and not in status or operator projections.",
      "content": "The existing installation capability authenticates closed-schema events: random run and event UUIDs, sequence, catalog pipeline ID, host, observed product version, timestamps, explicit user/synthetic/agent-test classification and started/resumed/completed/failed/cancelled state. Optional links contain only an existing signed receipt UUID/report digest or an owned incident report UUID. Run ownership, single-run receipt binding and the retained signature are checked server-side. The original stamping service does not attest the identity of the author of a report. The service receives no task text, client identity, filenames, source data, prompt or professional output. Existing connection metadata and rate limiting apply. Saved connector identity is not inferred to be a native computer. Native senders also present the existing anonymous native-computer capability and observed native app when available. The server retains the established computer binding; unlinked guests remain unlinked until an actual native proof is received. Connector-owned runs can obtain the bounded per-run proof described above; run-specific computer bindings are used by counts and completion indicators. No personal account information or hardware identifier is collected.",
      "optional": false,
      "activation": "automatic_on_first_use",
      "destination": "Existing Mparanza HTTPS operational-incidents API and saved veraIncidents OAuth connector"
    },
    {
      "runtime_profiles": [
        "openai-codex",
        "anthropic-cowork"
      ],
      "retention": "Task events, optional feedback and receipt links remain in the service until administrative deletion; no automatic expiry is implemented. Local queued events and acknowledgements remain in the existing private per-installation state directory. Lifecycle events exclude client documents and professional output. Optional feedback stores only the comment deliberately supplied by the user; its contents are not automatically anonymized.",
      "id": "optional-task-rating",
      "kind": "hosted_service",
      "destination": "Mparanza task feedback through the same authenticated connector/client or the per-run hosted form",
      "purpose": "Collect the user’s actual 1–5 stars and optional comment about the delivered result",
      "content": "The actual 1–5 integer score, up to 2000 characters of optional user-authored comment, source (chat or form), random event UUID and existing task binding. Nothing is copied automatically from professional context. The host asks once after delivery; no response is unrated. A low score offers one optional question about what failed or was expected.",
      "activation": "explicit_user_choice",
      "optional": true,
      "requires_confirmation": true,
      "controls": [
        "The user supplies the score/comment for submission or clicks Invia valutazione; that action is the choice, with no second confirmation questionnaire.",
        "The form uses a run-specific capability in its URL fragment; the page contains no task information, and the capability permits rating only that run. The exact pending answer is retained for retry, and operator rendering escapes comments.",
        "Comments are untrusted data for AI review, never instructions or executable commands. Feedback never changes public testing levels or closes incidents. Completed pipeline runs feed a separately resettable computer-based testing counter and never close incidents."
      ]
    },
    {
      "id": "public-completed-pipeline-status",
      "kind": "hosted_service",
      "destination": "Mparanza public GET /api/vera/testing-status and Vera function catalogue",
      "purpose": "Automatically show testing levels from concluded pipelines after an explicit fresh baseline",